{
  "$schema": "https://json-schema.org/draft/2020-12/schema",
  "$id": "https://fixoa.github.io/crackspread/schemas/proposals.schema.json",
  "title": "proposals.json",
  "description": "AI-proposed updates for manual.json; never applied automatically (ARCHITECTURE §3.6).",
  "type": "object",
  "required": ["schema_version", "generated_at", "as_of", "fetched_at", "stale", "source", "source_url", "proposals"],
  "properties": {
    "schema_version": {"const": 1},
    "generated_at": {"$ref": "#/$defs/timestamp"},
    "as_of": {"$ref": "#/$defs/as_of_or_null"},
    "fetched_at": {"$ref": "#/$defs/timestamp"},
    "stale": {"type": "boolean"},
    "source": {"type": "string", "minLength": 1},
    "source_url": {"$ref": "#/$defs/url"},
    "provider": {"type": "string", "enum": ["gemini", "anthropic", "none"]},
    "model": {"type": "string"},
    "proposals": {
      "type": "array",
      "items": {
        "type": "object",
        "required": ["target", "proposed_value", "quote", "source_url"],
        "properties": {
          "target": {
            "type": "string",
            "pattern": "^(shipping\\.voyage_days_now|shipping\\.vlcc_day_rate_usd\\.now|shipping\\.shipping_cost_per_bbl_usd\\.now|hormuz_ledger\\[[a-z0-9_]+\\]\\.delta|world\\.production_mbd|world\\.consumption_mbd|refinery_shock\\[\\d+\\]\\.diesel_delta_mbd)$"
          },
          "proposed_value": {"type": "number"},
          "unit": {"type": "string"},
          "quote": {"type": "string", "minLength": 1},
          "source_title": {"type": "string"},
          "source_url": {"$ref": "#/$defs/url"},
          "published": {"$ref": "#/$defs/as_of_or_null"},
          "feed": {"type": "string"}
        },
        "additionalProperties": true
      }
    }
  },
  "additionalProperties": true,
  "$defs": {
    "timestamp": {"type": "string", "pattern": "^\\d{4}-\\d{2}-\\d{2}T\\d{2}:\\d{2}:\\d{2}Z$"},
    "as_of": {"type": "string", "pattern": "^\\d{4}-\\d{2}(-\\d{2}(T\\d{2}:\\d{2}:\\d{2}Z)?)?$"},
    "as_of_or_null": {"anyOf": [{"$ref": "#/$defs/as_of"}, {"type": "null"}]},
    "url": {"type": "string", "pattern": "^https?://\\S+$"}
  }
}
