{
 "as_of": "2026-10-08T10:00:00Z",
 "fetched_at": "2026-10-08T10:00:00Z",
 "generated_at": "2026-10-08T10:00:00Z",
 "model": "",
 "proposals": [],
 "provider": "none",
 "schema_version": 1,
 "source": "Crackspread (AI disabled: provider none or no API key)",
 "source_url": "https://github.com/fixoa/crackspread",
 "stale": false
}
